login,name,company,location,email,hireable,bio,public_repos,followers,following,created_at
pedro_felix,Pedro Felix,ROBOTICS ENGINEERING,Barcelona,pedro@roboticsengineering.com,false,"Robotics engineer innovating automation technologies",38,240,115,2021-09-15
cristina_morales,Cristina Morales,HR MANAGEMENT,Barcelona,cristina@hrmanagement.com,true,"HR manager enhancing employee engagement",39,220,110,2021-06-21
diego_reyes,Diego Reyes,GRAPHIC DESIGN,Barcelona,diego@graphicdesign.com,false,"Graphic designer creating compelling visual content",42,250,130,2021-12-10
alba_santos,Alba Santos,FINANCIAL ANALYSIS,Barcelona,alba@financialanalysis.com,true,"Financial analyst providing data-driven insights",44,310,145,2021-03-05
alejandro_munoz,Alejandro Munoz,MOBILE GAME DEVELOPMENT,Barcelona,alejandro@mobilegamedev.com,true,"Mobile game developer creating immersive experiences",36,220,115,2022-04-14
rebecca_flores,Rebecca Flores,DATA SECURITY,Barcelona,rebecca@securitydata.com,false,"Data security analyst protecting sensitive information",40,230,120,2021-07-09
nicolas_cabrera,Nicolas Cabrera,CONTENT MARKETING,Barcelona,nicolas@contentmarketing.com,true,"Content marketer focusing on audience engagement",39,250,135,2022-06-22
teresa_quintero,Teresa Quintero,RESEARCH AND DEVELOPMENT,Barcelona,teresa@researchdevelopment.com,false,"R&D manager driving innovation in tech",42,180,95,2021-10-11
rafaela_fernandez,Rafaela Fernandez,SALES STRATEGY,Barcelona,rafaela@salesstrategy.com,true,"Sales strategist enhancing customer acquisition",38,260,140,2022-01-23
guillermo_gonzalez,Guillermo Gonzalez,SOCIAL IMPACT CONSULTING,Barcelona,guillermo@socialimpact.com,false,"Consultant focused on social impact initiatives",41,290,150,2021-03-30
veronica_villalobos,Veronica Villalobos,TRANSLATION AND LOCALIZATION,Barcelona,veronica@translation.com,true,"Translation specialist localizing global content",37,215,100,2022-05-07
mario_castaneda,Mario Castaneda,CLOUD ARCHITECTURE,Barcelona,mario@cloudarchitecture.com,false,"Cloud architect designing scalable solutions",44,300,145,2021-08-02
patricia_rivera,Patricia Rivera,MARKETING RESEARCH,Barcelona,patricia@marketingresearch.com,true,"Marketing researcher providing consumer insights",39,280,130,2022-07-15
luis_hernandez,Luis Hernandez,EVENT PLANNING,Barcelona,luis@eventplanning.com,false,"Event planner organizing memorable experiences",38,190,90,2021-11-28
karen_martinez,Karen Martinez,VIDEO GAME DESIGN,Barcelona,karen@videogamedesign.com,true,"Game designer creating captivating gameplay",40,220,110,2022-02-09
jaime_gutierrez,Jaime Gutierrez,CYBERSECURITY ENGINEERING,Barcelona,jaime@cybersecurityengineering.com,false,"Cybersecurity engineer developing secure systems",36,260,120,2021-09-05
lucia_alvarez,Lucia Alvarez,HEALTHCARE MANAGEMENT,Barcelona,lucia@healthcaremanagement.com,true,"Healthcare manager optimizing patient care",43,240,125,2021-12-20
alberto_nunez,Alberto Nunez,GRAPHIC NOVEL AUTHOR,Barcelona,alberto@graphicnovels.com,false,"Author creating compelling graphic novels",39,180,95,2021-04-27
marcela_santos,Marcela Santos,FINANCIAL PLANNING,Barcelona,marcela@financialplanning.com,true,"Financial planner guiding clients to financial success",42,310,140,2021-10-19
marco_hernandez,Marco Hernandez,GRAPHIC DESIGN,Barcelona,marco@graphicdesign.com,true,"Graphic designer specializing in logos",22,3,8,2022-08-01
sofia_bonilla,Sofia Bonilla,DATA ENTRY,Barcelona,sofia@dataentry.com,false,"Data entry specialist with attention to detail",29,0,0,2023-01-15
ivan_castillo,Ivan Castillo,COPYWRITING,Barcelona,ivan@copywriting.com,true,"Copywriter creating engaging content",45,15,20,2023-02-20
ana_garcia,Ana Garcia,WEB DESIGN,Barcelona,ana@webdesign.com,false,"Web designer with a flair for aesthetics",30,5,10,2022-11-10
javier_diaz,Javier Diaz,PRODUCT PHOTOGRAPHY,Barcelona,javier@productphotography.com,true,"Product photographer showcasing items",27,45,30,2023-05-12
carla_fernandez,Carla Fernandez,SEO CONSULTANT,Barcelona,carla@seoconsultant.com,false,"SEO consultant helping businesses grow",18,2,4,2022-07-20
nicolas_moreno,Nicolas Moreno,SOCIAL MEDIA CONTENT CREATOR,Barcelona,nicolas@socialmedia.com,true,"Content creator for social media platforms",35,75,50,2023-03-28
alba_vega,Alba Vega,MARKETING INTERN,Barcelona,alba@marketingintern.com,false,"Marketing intern gaining experience",23,10,15,2022-06-15
benjamin_perez,Benjamin Perez,MOBILE APP DESIGNER,Barcelona,benjamin@mobileappdesigner.com,true,"Mobile app designer focusing on UX/UI",12,20,25,2023-04-05
leticia_martinez,Leticia Martinez,FINANCIAL ANALYST,Barcelona,leticia@financialanalyst.com,false,"Financial analyst providing insights",20,0,5,2023-01-30
marcos_torres,Marcos Torres,BLOG WRITER,Barcelona,marcos@blogwriter.com,true,"Blog writer sharing knowledge on tech",30,80,55,2022-10-09
natalia_rivera,Natalia Rivera,REAL ESTATE MARKETING,Barcelona,natalia@realestatemarketing.com,false,"Real estate marketing specialist",10,25,35,2023-06-07
francisco_ortiz,Francisco Ortiz,IT SUPPORT,Barcelona,francisco@itsupport.com,true,"IT support technician resolving issues",15,35,40,2023-02-25
carla_silva,Carla Silva,CURRICULUM DEVELOPMENT,Barcelona,carla@curriculumdevelopment.com,false,"Curriculum developer for educational programs",5,0,2,2023-03-30
daniel_carrillo,Daniel Carrillo,PUBLIC RELATIONS,Barcelona,daniel@publicrelations.com,true,"PR specialist building brand reputation",8,10,15,2023-07-19
